{
  "schema_version": 2,
  "_doc": "Dogfood probes registry for v0.6.0-autonomy-chain retrospective spec. Each probe maps 1:1 with an acceptance_eval; gap_status reads .auto_probes_state.json + verify_report.md for verdicts.",
  "version": 2,
  "probes": [
    {
      "id": "p1-test-env-schema-v2",
      "description": "test_env.example.json validates against test_env.schema.json (required url; optional creds_ref + process_manager + auto_start_if_dead + schema_version).",
      "severity": "blocker",
      "auto_run": false,
      "recipe_drift_tolerance": "medium",
      "evidence": {"required_tools": ["code-grader"]}
    },
    {
      "id": "p2-probes-schema-v2",
      "description": "tests/test_new_tools.py::TestMigrateProbesV2 — v1->v2 migrate idempotent, dry-run no-write, missing file handled.",
      "severity": "blocker",
      "auto_run": false,
      "recipe_drift_tolerance": "medium",
      "evidence": {"required_tools": ["code-grader"]}
    },
    {
      "id": "p3-evidence-audit-config-driven",
      "description": "tests/test_new_tools.py::TestAdditionalEvidence — pattern hit on tool_result, counts_as not in required_tools is skipped.",
      "severity": "blocker",
      "auto_run": false,
      "recipe_drift_tolerance": "medium",
      "evidence": {"required_tools": ["code-grader"]}
    },
    {
      "id": "p4-mcp-call-runner-bridge",
      "description": "tests/test_new_tools.py::TestMcpCallCli — bad JSON args returns rc=2, unknown server returns rc=2.",
      "severity": "warn",
      "auto_run": false,
      "recipe_drift_tolerance": "medium",
      "evidence": {"required_tools": ["code-grader"]}
    },
    {
      "id": "p5-auto-run-probes-hook",
      "description": "tests/test_hooks_runtime_smoke.py::TestAutoRunProbes — hook exits 0 on irrelevant edit, no-op when auto_run=false, skips tests dir.",
      "severity": "blocker",
      "auto_run": false,
      "recipe_drift_tolerance": "medium",
      "evidence": {"required_tools": ["code-grader"]}
    },
    {
      "id": "p6-auto-test-runner-hook",
      "description": "tests/test_hooks_runtime_smoke.py::TestAutoTestRunner — no-op when no mapping matches, skips tests dir.",
      "severity": "blocker",
      "auto_run": false,
      "recipe_drift_tolerance": "medium",
      "evidence": {"required_tools": ["code-grader"]}
    },
    {
      "id": "p7-daemon-manager-hook",
      "description": "tests/test_hooks_runtime_smoke.py::TestDaemonManager — no-op when test_env missing, no-op on v1 schema, skips test edits.",
      "severity": "blocker",
      "auto_run": false,
      "recipe_drift_tolerance": "medium",
      "evidence": {"required_tools": ["code-grader"]}
    },
    {
      "id": "p8-creds-resolver",
      "description": "tests/test_new_tools.py::TestCredsResolver — env-file parsing (quoted strings, comments, blank lines), missing file returns empty dict.",
      "severity": "warn",
      "auto_run": false,
      "recipe_drift_tolerance": "medium",
      "evidence": {"required_tools": ["code-grader"]}
    },
    {
      "id": "p9-gap-status-engine",
      "description": "tests/test_new_tools.py::TestGapStatus — within-predicate, failing, unknown classification; markdown render contains table header.",
      "severity": "blocker",
      "auto_run": false,
      "recipe_drift_tolerance": "medium",
      "evidence": {"required_tools": ["code-grader"]}
    },
    {
      "id": "p10-gap-fix-cycle-diagnose",
      "description": "tests/test_diagnose_strategies.py — 3 strategies match expected error pattern, propose scoped patch, skip when no context.",
      "severity": "blocker",
      "auto_run": false,
      "recipe_drift_tolerance": "medium",
      "evidence": {"required_tools": ["code-grader"]}
    },
    {
      "id": "p11-recipe-to-probe-script",
      "description": "tests/test_new_tools.py::TestRecipeToProbeScript — pattern match preserves text order, template variable substitution from named groups.",
      "severity": "warn",
      "auto_run": false,
      "recipe_drift_tolerance": "medium",
      "evidence": {"required_tools": ["code-grader"]}
    },
    {
      "id": "p12-debug-sentry-split",
      "description": "tests/test_debug_sentry_split.py — STRONG matches Traceback/qualified exceptions; WEAK requires context window; bare ValueError in source NOT matched.",
      "severity": "blocker",
      "auto_run": false,
      "recipe_drift_tolerance": "medium",
      "evidence": {"required_tools": ["code-grader"]}
    }
  ]
}
